{"receipt_id":"EQA-REC-EXAMPLE-001","entity_ids":["CH-EXAMPLE"],"activity_id":"EQA-ACT-EXAMPLE-001","agent_ids":["EQA","volume-editor"],"input_artifact_ids":["ART-CH"],"rule_set_id":"MWM-EQA-RULES","specification_version":"0.1.0","model_tool_route":"local-validator-v1","evidence_ids":["TE-E1"],"decision":"track heading issue","decision_owner":"volume editor","timestamp":"2026-08-14T00:00:00Z","output_artifact_ids":["OUT-EXAMPLE"],"fixity_values":["sha256:out"],"residual_risk":"moderate","retention_class":"project","supersedes":null,"superseded_by":null,"owner_response":"Track for TE resolution."}
